Sujetos,lematizado,texto_crudo,coherencia_evolucion
22.0,buen acuerdo súper repentino habitación usar pc empezar haber duda si laburar mañana onda declarar feriado pasar decir intentar matar cristina cómo intentar matar cristina salir noticia salir afuera habitación salir ver viejo ver tele comedor decir intentar matar cristina shock ver onda si hacer feriado si hacer feriado si laburar si laburar etcétera ver terminar laburar igual si mal recordar feriado laborable decir feriado laborable empresa decidir laburar si mal recordar laburar día siguiente mucho discusión grupo etcétera realmente detalle acuerdo,"Bueno, acuerdo que fue súper repentino. Estaba en mi habitación usando la PC y de la nada empiezan a haber dudas de si, ¿laburábamos mañana? ¿Qué onda? ¿Que se declaraba feriado?. Y era como, ¿qué? ¿Qué pasó?. Y me dicen, intentaron matar a Cristina ¿Cómo que intentar matar a Cristina?. Y salgo con esa noticia, salgo afuera de la habitación, salgo a ver a mi viejo que estaba viendo la tele en el comedor y le digo, ¿intentaron matar a Cristina? Sí, sí, sí. Y como, nada, todo un shock. Estábamos todos viendo qué onda, si era o no se hacía feriado, si no se hacía feriado, si se laburaba, si no se laburaba, etc. Y nada, a ver, yo terminé laburando igual porque, si mal no recuerdo, fue feriado no laborable, es decir, feriado no laborable, nada, mi empresa decidió laburar, si mal no recuerdo, yo laburé al día siguiente. Y nada, fue muchas discusiones en el grupo, etc., pero realmente mucho más detalle no me acuerdo. ","[0.5168726022044817, 0.44711757519028406, 0.494903090596199, 0.4276692271232605, 0.4177822209894657, 0.4066822166953768, 0.42765545348326367, 0.43576236069202423, 0.48593905568122864, 0.4204157292842865, 0.46807315945625305, 0.5090094208717346]"
23.0,ok acuerdo acuerdo primero impresión tanto grave deber tomar tanto grave deber haber ser tardar caer jodido pasado primero resultar gracioso tipo triste obviamente cristina querer morir cómo ridículo alguien intentar matar alguien poder tanto simple disparar él tiro primero impresión risa después caer grave pasado obviamente escuchar montón opinión ojalá pasado cosa así indignar yo después debatir amigo parejo gente buen pasar incluso si favor opinión político cristino acuerdo querer hablar ayudante laboratorio 1 momento químico querer mencionar medio cara chico a ey interesar política buen querer discutir debatir docente grave así poder pasar acuerdo ver foto lado noticia lado parecer seguir demasiado tiempo quedar impresión idea seguir dar él mucho vuelta tema buen igual hoy seguir noticia,"Ok, ¿qué me acuerdo de esto? Me acuerdo como que mi primera impresión no fue tan grave como debería, o sea, como que no lo tomé como algo tan grave como debería haber sido, como que tardé en caer de lo jodido que era que haya pasado eso. Como que lo primero me resultó gracioso, tipo qué triste, obviamente yo no tengo nada en contra de Cristina y no quería para nada que se muera, pero cómo que qué ridículo que alguien intente matar a alguien y que no pueda, cuando algo tan simple como dispararle un tiro, esa fue mi primera impresión y de risa. Después como que fui cayendo de a poco en lo grave que era que eso haya pasado y obviamente de escuchar un montón de opiniones como ojalá hubiera pasado y cosas así, y de indignarme mucho con eso. Y después de estar debatiendo con amigos, con mi pareja, con gente, de por qué no estaría nada bueno que eso pase, incluso si no estás a favor de las opiniones políticas de Cristina y lo que sea. Más que nada eso, me acuerdo que algo quisimos hablar, yo estaba ayudante en Laboratorio 1 en ese momento para químicos y como que lo quisimos mencionar y medio que las caras de los chicos fueron de, ay no nos interesa la política. Pero bueno, como que quisimos discutir un poco y debatimos entre nosotros con los otros docentes sobre lo grave que era que algo así pueda pasar. Más que eso, me acuerdo que sí, ver fotos por todos lados y la noticia por todos lados, sí me pareció que se siguió demasiado tiempo. Como que me quedó la impresión de que ya se habían tenido un poco la idea y seguían dándole muchas vueltas al tema. Bueno, igual hasta hoy sigue estando en las noticias eso, pero eso. ","[0.6374951733483208, 0.6368861943483353, 0.6203641295433044, 0.6018258730570475, 0.609262478351593, 0.6396849155426025, 0.5845114588737488, 0.5421102941036224, 0.5577454566955566]"
24.0,buen intentar asesinato cristino trabajar suceder dar clase matemático 2 clase 19 22 creer 22 momento mirar celular hacer consulta después salir encontrar novio tampoco saber dar clase salir llegar ahí mesa pabellón 1 encontrar alguien ahí sentado franco decir tipo che ver pasar verdad poder creer venir haber casi día semana casa juncal ser sensación raro decir si clase seguramente ahí compañero ir ir después acuerdo sensación poder él creer pedir manada casa cristino día quedar movilización grande ir hacer día siguiente así casa novio ver televisión hablar compañero sentado sillón hablar dos callado recontra impactado imagen visto ser re fuerte pasar decir si bien único poder pensar único poder hablar ir yo crucir amiga llamar male hablar saber comentar hablar cosa hecho momento saber hablar después decir raro dijistir decir hablar creer sensación recordar poder creer garantía social decir dado asumido recontra romper pacto implícito violencia venir escalada además decir todo situación sentir terminar mal entonces acuerdo,"Bueno, en el intento de asesinato a Cristina, yo estaba trabajando cuando sucedió, estaba dando clases en matemática 2, la clase era hasta las 19 o hasta las 22. No, creo que hasta las 22, y yo en ese momento no estaba mirando el celular porque me estaban haciendo consultas y después cuando salí, me encontré con mi novio, él tampoco sabía nada porque también había estado dando clases, y salimos y llegamos ahí a la mesa del pabellón 1 y nos encontramos con alguien más que está ahí sentado que es Franco, y me dice tipo, che, ¿vieron lo que pasó? y la verdad que no lo podía creer. Veníamos a haber estado casi todos los días de esa semana en la casa de ella en Juncal, y había sido una sensación muy rara digamos porque si yo no hubiera tenido esa clase seguramente hubiera estado ahí, y tenía compañeros que iban a ir después también. Me acuerdo sobre todo esa sensación de no poderlos creer. También nos pidieron que no fuéramos todos en manada en la casa de Cristina ese día, que nos quedáramos y que la movilización grande se iba a hacer al día siguiente, así que yo me fui a la casa de mi novio y estábamos viendo la televisión y hablando con otros compañeros, sentados en el sillón y no hablábamos. O sea estábamos los dos callados, recontra impactados porque las imágenes que habíamos visto habían sido re fuertes. Y también me pasó digamos como si bien era lo único en lo que yo podía pensar y lo único de lo que podía hablar, antes de irme me cruzo con una amiga que se llama Male y hablamos y ella no sabía y no lo comentamos, hablamos otra cosa y ella se fue, y de hecho yo en ese momento como que ya lo sabía y ella no, y se fue y lo hablamos después y me dice, que raro que no me lo dijiste, digamos y no lo hablé con ella. Y creo que la sensación que más recuerdo es la de no poder creer, que son garantías sociales digamos que uno tiene dadas por asumidas y que se recontra rompió un pacto implícito de la violencia que ya venía en escalada. Además digamos como toda esa situación uno ya sentía que terminaba mal, entonces eso es lo que me acuerdo.","[0.5985300640265147, 0.6542279906570911, 0.6170360275677272, 0.6282581090927124, 0.640757429599762, 0.6592947691679001, 0.6416899959246317, 0.665368378162384, 0.5625077486038208]"
25.0,ok acuerdo enterar discord hablar amigo avisar pasado visto twitter ahí empezar buscar ver video material acuerdo ver sorprender montón pasado así mas allá todo situación poder pasar básicamente acuerdo amigo contar buscar ver después revuelo armado alrededor gente comentar twitter red básicamente,"Ok, esto, también me acuerdo de que me enteré estando en Discord hablando con unos amigos me avisaron que había pasado esto, que habían visto en Twitter. Y ahí empecé a buscar como para ver, estaba el video y todo, como el material. Y nada, me acuerdo que cuando lo vi me sorprendí un montón de que como que haya pasado algo así. O sea, mas allá, de todas las situaciones o que como que pueda pasar esto, y nada, básicamente eso me acuerdo de que estaba con unos amigos, me contaron, lo busqué y veo que después un poco todo el revuelo que se había armado alrededor, la gente comentando en Twitter y en otras redes, pero básicamente eso. ","[0.5782572229703268, 0.6198441088199615, 0.6894563436508179]"
26.0,intento asesinato cristino fernández kirchner recordar situación chistoso daniel casa ver recuerdo si serie peli viér mamá escribir ver intentar asesinar vicepresidenta decir a eh intentar asesinar vicepresidenta mente vicepresidenta cristino entonces buen asesinar bien seguir repetir vicepresidenta mal luego caer cuenta cristina a eh serio mal ahí poner noticia empezar ver día recuerdo acostar dormir tarde ver noticia repetir vez video recuerdo día declarar feriado mensajear yo franco si pertinente venir declarar feriado último hora justo supervisor escribir ir trabajar entonces día poder dormir tarde deber haber ir manifestación quedar dormir tarde,"En el intento de asesinato a Cristina Fernández de Kirchner, recuerdo que la situación chistosa fue que estaba con Daniel, en la casa de él, estábamos viendo, recuerdo si una serie o una peli, pero estábamos viéndo algo y la mamá le escribe, viste que intentaron asesinar a la vicepresidenta y él me dijo, ah, intentaron asesinar a la vicepresidenta. En mi mente no estaba que la vicepresidenta era Cristina, entonces fue como, bueno, no la asesinaron que bien. Y él seguía repitiendo como, pero a la vicepresidenta. Sí, qué mal. Luego cuando caí en cuenta que era Cristina, fue como, ah, no, en serio, qué mal. Y ahí pusimos las noticias y empezamos a ver. Más que de ese día, recuerdo que nos acostamos a dormir tarde viendo las noticias y repitiendo una y otra vez el video. Recuerdo que al otro día declararon feriado y estábamos mensajeándonos con Franco de si era pertinente venir o no, porque como que le declararon feriado a última hora y justo el supervisor de él le escribió que no tenía que ir a trabajar, entonces al otro día pudimos a dormir esta tarde. Debimos haber ido a las manifestaciones, pero nos quedamos durmiendo esta tarde. Y no, nada más. ","[0.5612616174750857, 0.4821840524673462, 0.4934599655015128, 0.5224063396453857, 0.5128333687782287, 0.5953687876462936, 0.47128554185231525, 0.4378385543823242, 0.25216037034988403]"
27.0,acuerdo acuerdo enterar día siguiente creer viernes dar clase 7 mañana cbc entonces día anterior dormir temprano levanté saber 6 mañana menos mails pibe preguntar yo si dar clase onda ahí enterar así día acuerdo acuerdo día siguiente cerrado igual facultad decir pibe si abierto quedar hacer clase consulta menos facultad abierto así volver casa seguir dormir obvio despertar 6 mañana después día después día acuerdo dónde seguir acuerdo hacer acuerdo día tarde entrenar después día viernes hacer acuerdo hacer trascendental acuerdo desayunar,"Eso me acuerdo poco. Me acuerdo que me enteré al día siguiente porque creo que fue un viernes que yo daba clase a las 7 de la mañana en el CBC, entonces el día anterior me fui a dormir muy temprano y cuando me levanté, tenía, no sé, a las 6 de la mañana más o menos, tenía mails de los pibes preguntándome si daba clase, qué onda, y ahí me enteré de todo. Así que del día en sí no me acuerdo, pero me acuerdo que al día siguiente se había cerrado todo. Igual fui a la facultad, yo le dije a los pibes que si estaba abierto, yo me quedaba haciendo clases, consultas por lo menos, fui a la facultad y no estaba abierto. Así que me volví a casa, y me fui a seguir durmiendo, obvio, porque me despertaba a las 6 de la mañana. Pero después de ese día, después de eso, el día no me acuerdo por dónde seguía, no me acuerdo qué hice, no me acuerdo qué día de la tarde, porque no entrenaba. No, después de ese día viernes no hice nada, no me acuerdo nada más que hice, no fue muy trascendental. No, no me acuerdo ni qué desayuné.","[0.5934620031288692, 0.5598593056201935, 0.5608214914798737, 0.5121964439749718, 0.5571818351745605, 0.44657279551029205, 0.5755668878555298]"
28.0,intento asesinato cristino kirchner acuerdo verdad acuerdo sentir recuerdo último vez venir hablar verdad ahora acuerdo pasar día si acuerdo principio pensar jodo ser arma juguete labo acuerdo si día anterior mismo día si verdad acuerdo noche labo pasar entonces olvidar suponer franco pasado dicho podcast osear acuerdo contar creer contar si recordar contar seba saber ver pasar decir ver decir deber ser plástico pistola final si verdad así hoy cumplir año parecer escuchar radio mañana radio re progre escuchar ridículo acuerdo verdad,"Intento asesinato a Cristina Kirchner no me acuerdo. La verdad no me acuerdo mucho siento que, tengo el recuerdo como que la última vez que vine hablé más de esto pero la verdad que ahora no me acuerdo mucho que pasó ese día. O sea, si me acuerdo que al principio yo pensé que era como joda, como que había sido un arma de juguete y que estaba en el labo, pero no me acuerdo si fue el día anterior, el mismo día eso. Si la verdad no me acuerdo para nada, fue a la noche o fue en el labo cuando pasó, entonces ya me olvidé o sea, supongo que Franco del pasado lo habrá dicho en el podcast de antes. Osea, me acuerdo que cuando me lo contaron creo que me lo contó, si tengo el recuerdo que me lo contó Sebas pero no sé, habría que ver qué pasó yo dije, como que lo vi y dije no, pero debe ser como de plástico la pistola. Nada y al final si, era verdad así que nada, es más, hoy se cumple un año me parece ¿no? lo escuché en la radio de la mañana nada, radio re progre que estoy escuchando. Ridículo nada, eso, no me acuerdo más de eso, la verdad.","[0.5816185218947274, 0.6006440619627634, 0.5663443446159363, 0.5407806932926178, 0.44196800390879315, 0.4454738646745682, 0.4863858222961426]"
29.0,recordar enterar bastante tarde grupo whatsapp pedro mandar mensaje grupo todyy reír él todavía comentar intento asesinato yegua decir pedro ahí interpretar decir cómo cristina abrir tipo poner noticia efectivamente noticia intentar asesinar cristina todavía entender canal así cerrar poner buscar youtube recorte etcétera ser intento ahí ver primero imagen dirigir él auto escoltado aún así aparecer pistola cara ver intentar disparar funcionar buscar toque alguno nota escrito ver si saber pasado quién ser si alguno ideología detrás particularmente creer ser jueves noche mirar 10 terminar comer 11 medio menos mirar papá azu mamá computadora atrás azu angustir hecho suceso así eventualmente esclarecido cristina bien pasado cerrar dormir intentar dormir decir,"Recuerdo que en sí me enteré bastante tarde por un grupo de WhatsApp. Pedro mandó un mensaje por el grupo de Todyys, riendose de que como que todavía no habíamos comentado nada sobre el intento de asesinato de la Yegua, le dijo Pedro. Y ahí como que yo no interpreté de una, pero le dije ¿cómo Cristina? y abrimos tipo, pusimos las noticias y estaba efectivamente la noticia de que habían intentado asesinar a Cristina. Todavía no se entendía nada en los canales, así que cerramos y nos pusimos a buscar en YouTube recortes o etc. de como había sido el intento en sí. Que ahí fue donde vimos las primeras imágenes de ella dirigiéndose a un auto escoltada, pero aún así que le aparece una pistola en la cara y que se ve que intenta disparar y que no funciona. También buscamos al toque alguna que otra nota o algo escrito, a ver si se sabía como que había pasado, quién había sido, si había alguna ideología detrás, pero no particularmente. Esto creo que habrá sido un jueves a la noche, lo miramos entre las 10 que ya habíamos terminado de comer, estábamos a las 11 y media más o menos. Que todo esto lo estábamos mirando con mi papá, Azu, mamá estaba en la computadora y atrás. Azu se angustió mucho de hecho por el suceso, así que eventualmente como que ya esclarecido que Cristina estaba bien y que no había pasado nada, cerramos todo y nos fuimos a dormir. A intentar dormir, digo. ","[0.5648238144137643, 0.5353413641452789, 0.5259969002670712, 0.5037151351571083, 0.49212567295346943, 0.49705150723457336, 0.5100325167179107, 0.45864560827612877, 0.352119838198026, 0.27590198814868927, 0.25301802158355713]"
30.0,bien acuerdo principio tomar dar importancia momento acuerdo enterar noche intento asesinato decir buir si dar mucho importancia momento decir faranduleo medio tratar magnificar ahí prestado mucho atención noticia día acuerdo venir acá iafe instituto astronomía físico espacio acá ciudad universitario llegar mensaje mañana temprano cerrar tema luto hacer asueto incidente entonces ahí empezar recapitular empezar leer empezar ver pasado ahí empezar llamar atención decir pasar tomado real potencia verdad significancia pasado acuerdo día asueto comprar viejo encontrar vecino poner charlar viejo detalle totalmente anecdótico acuerdo decir querer ganar milei si llegar saber acuerdo dicho único querer ver ahí milei dicho hablar quién ir ser próximo presidente decir idea gustar acuerdo acuerdo detalle cierto," Bien, con este me acuerdo que yo al principio lo tomé, no le di importancia en su momento, porque me acuerdo que me enteré de noche del intento de asesinato y como dije a bue si, no le di mucha importancia en el momento porque dije faranduleo de los medios, estaban tratando de magnificar algo que por ahí no le había prestado mucha atención a la noticia. Y al otro día, me acuerdo que venía acá al IAFE, al Instituto de Astronomía y Física del Espacio, que está acá en Ciudad Universitaria, y me llega un mensaje a la mañana temprano de que cierran por el tema del... no es luto, es como hicieron asueto por el incidente. Entonces ahí empecé a recapitular, empecé a leer, empecé a ver qué había pasado, ahí sí me empecé a llamar la atención porque digo, qué pasó, no lo había tomado con la real potencia o verdad significancia de lo que había pasado. Me acuerdo que ese día que estuvo el asueto, me fui a comprar con mi vieja y nos encontramos con unos vecinos y que se pusieron a charlar con mi vieja, es un detalle totalmente anecdótico, pero me acuerdo que yo les dije que yo no quería que ganen Milei si llegaba. No sé por qué, pero me acuerdo que había dicho eso, que el único que no quería que tenga nada que ver ahí era Milei, porque habían dicho, estaban hablando de quién iba a ser el próximo presidente, y yo decía que sus ideas no me gustaban para nada. Eso me acuerdo nada más. Pero por qué me acuerdo de ese detalle, por cierto. ","[0.5801370839277903, 0.5643730521202087, 0.5648979172110558, 0.5367278059323629, 0.4730631411075592, 0.5732012391090393]"
31.0,buen día intentar asesinato cristino acuerdo cumpleaños amigo tommy bar acuerdo día ir comer ahí amigo acuerdo momento enterar intento parte exterior bar especie patio espacioso buen ahí hablar gente momento alguien sorprender ver video pasado muestra quedar bastante shockeado momento poner hablar realmente entender después acuerdo ir lugar minuto ratito si minuto salir bar quedar hablar 5 minuto ahí afuera boludez pasar bastante desapercibido momento después esquina bar poner hablar amigo cómo ir volver si ir juntar quedar final salir simplemente ahí caminar lado tomar saber si uber bondi creer uber después llegar casa buen enterar yo acuerdo llegado lugar mesa acuerdo saludado pedido tipo hamburguesa así comer hablar buen remera comprar cumpleañero attack on titan …y attack on titan acuerdo ver pedir pedir hamburguesa hablar cómo llegar,"Bueno, el día del intento de asesinato de Cristina, me acuerdo que estaba en el cumpleaños de un amigo, Tommy, en un bar. Me acuerdo que ese día habíamos ido a comer algo, a estar ahí entre amigos. Y me acuerdo que en el momento en el que me enteré del intento, estaba en una parte exterior del bar, que era como una especie de patio, que no era muy espacioso. Pero bueno, estábamos ahí hablando con la gente. Y en un momento alguien nos sorprende, porque ve un video de lo que había pasado y nos muestra. Y nos quedamos todos bastante shockeados. Y en ese momento nos pusimos a hablar de eso, porque realmente era como que no entendíamos nada. Y después de eso, me acuerdo que nos estábamos yendo del lugar, y nos fuimos a los minutos, o al ratito, si no a los minutos. Y salimos del bar y nos quedamos hablando también 5 minutos ahí afuera de boludeces, como que fue algo que pasó bastante desapercibido en el momento. Y después de eso me fui para la esquina del bar y me puse a hablar con mis amigos sobre cómo nos íbamos a volver o si nos íbamos a juntar con los que quedaban. Al final no salió nada y simplemente de ahí, cuando se fueron todos, me fui caminando para otro lado y me tomé no sé si un Uber o el bondi, creo que un Uber. Y después de eso llegué a casa. 
Bueno, antes de enterarme de eso, me acuerdo que había llegado al lugar y estábamos todos en una mesa. Me acuerdo que los había saludado todos y me había pedido tipo una hamburguesa o algo así para comer. Y estábamos hablando de lo buena que estaba la remera que se había comprado el cumpleañero, que era sobre Attack on Titan…/.Y no, sí, sobre Attack on Titan. Y me acuerdo que estábamos viendo qué pedir y yo me pedí eso, una hamburguesa. Y antes de eso estábamos hablando sobre cómo llegar.","[0.5836488362401724, 0.6064113895098369, 0.6022259954895292, 0.5958156814941993, 0.5962384218970934, 0.5945315929976377, 0.6009883463382721, 0.5859932833247714, 0.6226488873362541, 0.5835359437125069, 0.5976355075836182, 0.6150036454200745, 0.5749450251460075, 0.5609260102113088, 0.6520242691040039, 0.7092036604881287]"
32.0,cenar casa compañero trabajo twitter creer salir noticia leer ahí mientras cenar quedar impactado trabajar política revista tú sorprender empezar buscar información encontrar contacto si alguien ahí casa cristino mientras hablar cena trabajo equipo frijol arroz 7 ahí compañera vinir suecio proyecto compañera venir córdoba creer dos señora ahí cenar entrar twitter poder creer pensar jodo fake new saber ahí empezar saber cierto seguir cenar después cada saber caso día siguiente checar ahí información video canal dar piba ahí ver cómo pebir hacer cobertura vivo casa ver ahí imagen acuerdo,"Estábamos cenando en la casa de un compañero de trabajo y por Twitter creo que salió la noticia y la leímos ahí mientras cenábamos. Quedamos todos muy impactados. Nosotros trabajamos con política en una revista y nos re sorprendió y empezamos a buscar información, a encontrar otros contactos, si había alguien ahí en la casa de Cristina. Mientras estábamos hablando de esta cena como de trabajo con un equipo, frijoles con arroz, éramos como 7 ahí, estaban también otras compañeras que vinieron de Suecia por este proyecto y otra compañera que venía de Córdoba, creo, dos señoras. Estamos ahí cenando, nos entramos por Twitter, no lo podíamos creer, pensamos que era una joda, como que era una fake news, no sé, hasta que ahí se empezó a saber que era cierto. Seguimos cenando. Y después cada uno, no sé en su caso, el día siguiente chequé por ahí en otra información de un video de un canal que se dio de una piba y ahí vi cómo esta piba estaba haciendo una cobertura en vivo en la casa de ella y se ve ahí como la imagen en sí. Pero eso es de lo que me acuerdo.","[0.49743678314345224, 0.5159309556086858, 0.5490099310874939, 0.511924684047699, 0.44554176926612854, 0.6145546734333038, 0.5532892346382141]"
33.0,intento asesinato cristino fernández kirchner buen acuerdo facu volver casa entrar mamá papá pegado tele ver ojo plato papá mirar alterar decir intentar matar cristina decir cómo principio tomar serio cara pánico decir buen ok ahí poner ver tele mamá papá acuerdo impresionar después empezar mandar grupo amigo leer gabriel especular ver si ser tipo armado mentira gabriel leo mano mano leo shockeante volver tarde tipo siete ocho noche,"Intento de asesinato a Cristina Fernández de Kirchner. Bueno, yo me acuerdo que estaba en la facu y que volví a mi casa y entré y estaban mamá y papá pegados a la tele viendo, con los ojos como platos y mi papá me mira todo alterado y me dice que intentaron matar a Cristina. Yo le digo, ¿cómo? Al principio no me lo tomé en serio. Pero nada, las caras de ellos, de pánico, dije bueno, ok. Y ahí me puse a ver la tele con mamá y papá y nada, me acuerdo que me impresionó y después empezamos a mandar en el grupo que tengo con unos amigos, con Leo y Gabriel, especulando a ver si había sido, no, tipo armado o qué. Mentira, Gabriel no estaba, era con Leo. Era mano a mano con Leo y nada, eso. Que fue, fue shockeante. Volví era tarde ya, era tipo siete, ocho de la noche. Eso.","[0.46441055337587994, 0.4126185141503811, 0.4740149549075535, 0.3903913547595342, 0.40705650448799136, 0.40165625512599945, 0.36234648029009503, 0.29846829175949097, 0.2633405029773712]"
