Sujetos,lematizado,texto_crudo,coherencia_evolucion
34.0,acuerdo bastante vívido tipo gif pasar noticiero video chabón sacar arma cristino tipo agachar él rápidamente entrar auto acuerdo reacción amigo poder ser atentado tipo nervioso mal parecer locura afectar emocionalmente varios amigo bajón resto día gente parar hablar acuerdo ninguno detalle mas parecer hacer hacer después,"Me acuerdo bastante vívida tipo el gif que pasaban en los noticieros. El video del chabón sacando el arma y Cristina tipo agachándose rápidamente y entrando al auto. Y me acuerdo de la reacción de todos mis amigos, que no podía ser, que era un atentado y estaban tipo muy nerviosos, muy mal. A mi me pareció una locura pero no me afectó tanto emocionalmente. Pero tenía varios amigos que estaban muy bajón. Y el resto del día la gente no paró de hablar de eso. No me acuerdo de ningún detalle mas me parece, ni lo que hacía antes ni lo que hacía después.","[0.5520054598649343, 0.540524834394455, 0.5801530927419662, 0.5483167966206869, 0.503686934709549, 0.4452308416366577]"
35.0,intento asesinato cristino acuerdo obvio día acuerdo detalle día creer recordar seguro creer recordar día venir entrenar momento mirar programa llamar caricia significativo rebor elisa alvo periodista tommy siclian creer facu acuerdo normalmente confundir nombre pibe facu buen tres pibe dos pibe piba hacer programa así medio radio ahora así transmitir youtube saber acuerdo venir entrenar creer casi seguro poner ver programa radio acuerdo día hacer suerte sketch mirar chat pelotudear gente re obsesionado pasar tú boludear re grave saber entonces poner ver pasar ahí enterar querido matar cristina poner noticiero toque ver buen imagen siempre mostrar chabón intentar gatillar él escena medio raro caer libro caer libro entonces mina medio dar cuenta querer disparar situación medio medio raro entonces principio parecer mina agachado querido disparar después parecer libro acuerdo acuerdo programa radio particularmente seguir hacer sketch gracioso durar 15 minuto intento asesinato cristino gente histérico chat youtube tipo poner terrible saber tú seguir boludear después chabón enterar hacer suerte sketch mirar chat enterar buen buen bien tampoco culpa pasar hacer programa siempre acuerdo particularmente momento mirar pasado recuerdo sentimiento particular respecto raro creer acuerdo venir mente ahora acuerdo repetir tiempo vez mismo escena justo filmar chabón sacar arma agacha acuerdo bien situación medio raro sacar arma caer justo libro chabón empujar alguien parecer caer libro entonces mina firmar agacha agarrar él raro acuerdo pasar vez imagen único recuerdo particular,"Del intento de asesinato de Cristina me acuerdo. O sea, obvio que durante el día, no me acuerdo, no tengo detalles del día. Sí creo recordar, no estoy seguro, creo recordar que ese día venía a entrenar y yo en ese momento miraba un programa que se llama Caricia Significativas, donde estaban Rebor y Elisa Alvo y otro periodista más, que es Tommy Siclian, creo que es. O ese es uno de la facu, no me acuerdo, normalmente me estoy confundiendo con el nombre de un pibe de la facu. Bueno, eran tres pibes, o dos pibes y una piba que hacían un programa así medio de radio de estos que están ahora, que son así, se transmiten por YouTube y qué sé yo. Y me acuerdo que yo venía de entrenar, creo, estoy casi seguro, y me puse a ver el programa de radio y lo que sí me acuerdo de ese día es que ellos estaban haciendo una suerte de sketch sin mirar el chat, estaban pelotudeando y la gente estaba como re obsesionada, como que pasaba algo, no, que ustedes están boludeando, esto es re grave, no sé qué. Entonces me puse a ver qué estaba pasando y ahí me enteré que habían querido matar a Cristina. Y nada, puse el noticiero un toque y vi, o sea, bueno, las imágenes de siempre, esas donde mostraban al chabón como intentaba gatillarle. Esa escena medio rara donde a ella se le cae el libro, como que se cae un libro, entonces la mina medio que no se da cuenta, que le quieren disparar, una situación medio, todo medio raro. Entonces al principio parecía que la mina se había agachado porque le habían querido disparar, pero después parece que era por lo del libro. Nada, me acuerdo de eso y me acuerdo lo del programa de radio particularmente, de que ellos seguían haciendo el sketch ese gracioso que duró como 15 minutos más desde el intento de asesinato de Cristina. Y la gente estaba como muy histérica en el chat de YouTube, tipo poniendo, no, que esto es terrible, no sé qué, ustedes siguen boludeando. Y después los chabones se enteraron de eso, porque estaban haciendo una suerte de sketch sin mirar el chat y se enteraron y bueno, fue como, bueno, está bien, tampoco tenemos la culpa de lo que pasó, o sea, estábamos haciendo el programa de siempre. O sea, me acuerdo muy particularmente de eso y del momento de mirar qué había pasado. No recuerdo un sentimiento particular con respecto a eso, fue como todo muy raro. Y creo que eso es todo lo que me acuerdo, o lo que me viene a la mente ahora. 
Me acuerdo que repetían todo el tiempo una y otra vez la misma escena, como que justo estaban filmando al chabón cuando saca el arma, ella como que se agacha. No me acuerdo bien de esta situación, es medio rara. Como que saca el arma, se cae justo el libro, porque el chabón le empuja a alguien me parece, y se le cae un libro a uno, entonces la mina estaba como por firmar y se agacha a agarrarlo, todo muy raro. Me acuerdo que pasaban una y otra vez esa imagen, es como el único recuerdo particular que tengo. Pero más de eso, no, nada.","[0.5873474463820457, 0.5837786197662354, 0.5923203014665179, 0.5762970342355616, 0.5644288994371891, 0.609772100051244, 0.5727442268814359, 0.5582861373057733, 0.5914212192098299, 0.6044635799798098, 0.5632444024085999, 0.5818864040904574, 0.5882844217121601, 0.5925250777176448, 0.5454841603835424, 0.5396715879440308, 0.5572628304362297, 0.5094401836395264, 0.5421206653118134, 0.3210917115211487]"
36.0,intento asesinato cristino fernandez kirchner bien acuerdo acuerdo siquiera seguro ahora sentir año pasado 2022 acuerdo tipo shockeante principio enterar querer creer tipo buscar video ver onda pasado sorprender yo ver él sensación che cómo llegar acá tristeza acuerdo enterar yo decretar feriado próximo día trabajo acuerdo chocar trabajo decir che entender país presidente decretado feriado cada libre trabajar medio sentir cosa che buen reconocer bien saber tomar yo día considerar gravedad buen país parir dar él realmente respeto peso merecer buen acuerdo haber yo enterar papá volver trabajar contar shock acuerdo acuerdo día siguiente efectivamente trabajar saber jueves,"Intento de asesinato a Cristina Fernandez de Kirchner. Bien, me acuerdo, me acuerdo, ni siquiera estoy seguro ahora, pero siento que fue el año pasado, en 2022. Me acuerdo que fue tipo shockeante, que al principio, cuando me enteré, un poco no lo quería creer, y fue tipo buscar el video, a ver qué onda, qué es lo que había pasado. Sorprenderme al verlo. Un poco esta sensación de, che, ¿cómo llegamos acá? Un poco tristeza y eso. Me acuerdo, nada, enterarme que se decretó feriado para el próximo día y que en el trabajo me acuerdo como esta choca en el que en el trabajo decían, che, entendemos que el país, el presidente haya decretado feriado. Nada, cada uno libre de trabajar o no, y medio sentir esta cosa de, che, como que está bueno reconocer que esto no estuvo bien. Como que, no sé, tomarnos un día para considerar la gravedad está bueno. O sea, que el país pare, como para darle realmente el respeto o el peso que se merece está bueno. Pero nada, me acuerdo de haberme enterado porque mi papá cuando volvió de trabajar me contó y eso, shock. No me acuerdo mucho más. Me acuerdo sí del día siguiente que efectivamente fui a trabajar porque no sé qué había, pero no mucho más. 
Era jueves.","[0.4871314465999603, 0.48110561197002727, 0.47988544539971784, 0.48059885650873185, 0.46664263639185166, 0.41947637125849724, 0.39216854742595125, 0.5100872814655304, 0.3418367952108383, 0.43753689527511597, 0.3574586759010951, 0.2918604463338852, 0.17795807123184204]"
37.0,buen problema menos acuerdo saber ser viernes cursar materia investigación operativo parcial día entonces levantar yo a eh inicialmente trabajar quilme claro cancelado laburo buen levantar yo buen intentar asesinar cristina saber decretado feriado asueto saber si feriado asueto tanto seguro entonces prender compu laburo después confirmar decir dejar trabajar creer acuerdo si feriado buen trabajar así apagar mismo tiempo cómo ir cerrar facultad ir abrir facultad tampoco entonces esperar confirmación pasar parcial buen decir parcial suspender pasar semana siguiente tampoco facultad nomás cambiar justo parcial ir preparar menos suspender así buen genial viajar estación universitario cambiar viernes," Bueno, en este tenemos un problema, porque es el que menos me acuerdo. Sé que había sido un viernes. Porque también cursaba esta materia que era investigación operativa y teníamos parcial ese día. Entonces fue como levantarme. Ah, inicialmente trabajaba en Quilmes. Claro, también me habían cancelado el laburo. Pero bueno, fue levantarme y era como, bueno, intentaron asesinar a Cristina, qué sé yo, y se había decretado feriado, pero no estaba como asueto, no sé si era feriado o asueto, pero no estaba tan seguro. Entonces fue como que prendí la compu del laburo y después como que confirmaron diciendo, no, tienen que dejar de trabajar, porque creo que, no me acuerdo si era feriado. Pero bueno, nada, no teníamos que trabajar más, así que lo apagué. Y nada, al mismo tiempo era cómo, va a cerrar la facultad, o sea, no va a abrir la facultad tampoco, entonces era como que estábamos esperando la confirmación de qué pasa con el parcial. Y bueno, yo me dije que el parcial se suspendía, o sea, se pasaba para la semana siguiente. Y nada, tampoco fuimos a la facultad, nomás. O sea, para mí no me cambiaba nada, porque era justo un parcial donde no lo iba a preparar más o menos porque se suspendía, así que fue como, bueno, genial. No tuve que viajar a la estación universitaria, pero fuera de eso como que no me cambia mucho. Y nada, eso es todo de ese viernes.","[0.4893546551465988, 0.5392827552098495, 0.5126615837216377, 0.4843316918069666, 0.49468386769294737, 0.5272015300061967, 0.4718811344355345, 0.48469989214624676, 0.44147903223832446, 0.45399858355522155, 0.4775046557188034, 0.5185532172520956, 0.642052412033081, 0.5811609625816345]"
38.0,pregunta acordar saber acordar creer día así viernes acuerdo si estudiar final así día facultad acuerdo llamar papá decir pasado persona creer fake new tardar aprender buen decir cierto decir deber ser mentira inventado alguien prender noticia ver cierto poder ser acuerdo querer acuerdo si querer ir plaza así justo venir mamá viaje querer var cosa estilo acuerdo día solo acuerdo escena sentado computadora venir mamá decir yo verdad acuerdo así noche hecho cadena nacional alberto hablar dicho cosa acuerdo imagen si después viralizar día persona apuntar él bajar él auto acuerdo día siguiente acuerdo si semana siguiente directiva general justo compañera pulserita cristino cfk tipo blanquito azul dicho día ahí contar justo hecho actividad respecto suerte pregunta creer hablar escuela cosa así gente acuerdo idea ver si tema relevante secundario obvio si acuerdo día siguiente feriado clase pasado estilo día día después así creer acuerdo sensación pensar obvio re mal montón pensar poder pasar después si ir haber alguno tipo represalia obvio después gente generar re calle hecho si ir haber crisis palabra fuerte sentir hecho bastante importante ir generar alguno tipo repercusión,"De esta pregunta también me acordaba porque sabía, algunas me acordaba. Y creo que el día ese era algo así como un viernes. Y yo no me acuerdo si estaba estudiando para un final o algo así, como todos los días en la facultad, pero me acuerdo que me llamó mi papá y me dijo que había pasado eso, él es de las personas que se cree mucho como las fake news, como que tardó en aprender lo de bueno, no se dice, no es cierto, y yo le decía no, que eso debe ser mentira, que lo había inventado alguien, y prendí las noticias y vi que era cierto, y yo estaba como, no, no puede ser, no se que. Me acuerdo que yo quería, no me acuerdo si quería ir a la plaza o algo así. Y justo había venido mi mamá de viaje, como que no quería que vayamos o una cosa por el estilo. Me acuerdo, más que de ese día, solo me acuerdo como la escena de yo estar sentada en la computadora, y como que venga mi mamá a decirme que no, que era verdad, que esto y lo otro. Me acuerdo que era como algo así de noche, porque habían hecho como una cadena nacional, Alberto había hablado y dicho cosas. Me acuerdo más de algunas imágenes que no se si fue después que se viralizaron de ese día, como de la persona apuntándole y ella bajándose del auto. Y lo que sí me acuerdo, el día siguiente, o no me acuerdo si la semana siguiente, que teníamos directiva general y justo una compañera tenía como una pulserita de Cristina, que era como CFK, tipo blanquito y azul, que había dicho como que ella había estado ese día ahí y nos había contado un poco y justo habíamos hecho una actividad al respecto, que tenían como una suerte de preguntas, de que no se porque creen que se tiene que hablar esto en la escuela y cosas así, y había gente que no estaba de acuerdo, pero como la idea era ver si esos temas eran relevantes o no en el secundario, que obvio que si. Y me acuerdo que el día siguiente fue feriado o que no había clases o que había pasado algo por el estilo del día antes o el día después, algo así. 
 Creo que me acuerdo más como sensaciones de pensar que como que era obvio que estaba re mal y que era un montón, pero más que nada como pensar en que podía pasar después, como que si iba a haber algún tipo de, no represalia, pero obvio que después la gente genera el re fue a la calle y todo, pero como el hecho de que si iba a haber no crisis. Como que es una palabra muy fuerte, pero nada, como que sentía que era un hecho bastante importante y que iba a generar algún tipo de repercusión.","[0.6711981459097429, 0.660274213552475, 0.6646161874135336, 0.6557012125849724, 0.6819579005241394, 0.6374849279721578, 0.6062585890293122, 0.6570310890674591, 0.6366974910100301, 0.6546081602573395, 0.5598025321960449]"
39.0,saber si acuerdo bien día recordar hacer día saber particular día común corriente si equivonar recordar ver él televisión abuela capaz decir distinto vez acuerdo ahora exactamente creer así abuela ver recién pasado noticia vivo noticia suceder recién intentar asesinato acuerdo día semana pensar hacer día haber hacer blanco completamente recuerdo específico creer abuela hablar amigo respecto whatsapp acuerdo ahora realmente buen si pensar ir acordar ahí carpeta cabeza venir cosa discusión respecto intento asesinato persona día tiempo después hablar gente respecto recordar hacer día quizás través tiempo capaz semana hablar amigo si día siguiente hablar viejo capaz mismo día hablar viejo sinceramente referencia tiempo tanto particular saber hablar gente tiempo claro recordar hablar amigo estudiar medicina hablar instagram cosa resultar preguntar venir día día intento asesinato problema hospital respecto acuerdo hablar día asesinato contar tiempo después," No sé si me acuerdo bien el día, ya esto no era algo que me recordara mucho que hice yo ese día, porque sé que no tuve nada particular, no, fue un día común y corriente para mí. Si no me equivoco, recuerdo verlo en la televisión en lo de mi abuela esto. Capaz que dije algo distinto la otra vez porque no me acuerdo ahora exactamente. Pero creo que fue así, que estando en lo de mi abuela vi que esto había recién pasado, como noticia, no en vivo, noticia de esto sucedió recién, el intento asesinato. No me acuerdo ni qué día de la semana era, estoy pensando qué hice ese día, qué tendría que haber hecho, pero tengo un blanco completamente. No recuerdo nada muy específico más. Que creo que estaba en lo de mi abuela. Hablé con algunos amigos al respecto de esto por whatsapp, no me acuerdo, ahora no realmente no tengo nada. No es como, bueno tengo algo que si pienso un poco más me voy a acordar, es como que no hay nada ahí. No tengo esa carpeta en la cabeza, no, me vienen cosas, como de discusiones al respecto del intento asesinato que tuve con algunas personas pero no en el día. Tiempo después hablé con gente al respecto de esto. No recuerdo qué hice ese día. Quizás, a través del tiempo, capaz a la semana hablé con un amigo o si al día siguiente habré hablado con mis viejos, capaz que el mismo día hablé con mis viejos. Sinceramente no tengo una referencia de tiempo tan particular. Es como, sé que hablé de esto con gente en ese tiempo, claro, lo que más recuerdo es que hablé de esto con un amigo mío, que estudia medicina. Le hablé por instagram por otra cosa y resulta que le pregunté como venía, él ese día había tenido, o sea el día del intento asesinato, tuvo un problema en el hospital al respecto. Me acuerdo de eso pero no hablé con él en el día del asesinato, él me contó esto tiempo después.
","[0.5644328482449055, 0.5940669020016988, 0.6031047105789185, 0.5935636162757874, 0.5890214617053667, 0.6510202153162523, 0.5909502625465393, 0.6032178103923798, 0.5614588297903538, 0.5573867048536029, 0.6099783778190613, 0.60825674533844, 0.5931457951664925, 0.6374432047208151, 0.6133780479431152, 0.7011232376098633]"
